,subreddit,id,title,selftext,upvote_ratio,ups,downs,score,Over 18?
92,loneliness,t5_2rlb9180rylb,Moving back home,"I am thinking of moving back home after I graduate college. I went to school far from home, it's my Dad's alma mater school. I am very unhappy. I haven't told anyone, especially my family, because I know it will upset him. I have been here for 2 years and I still don't have any sense of belonging or a true honest connection. I thought I was close to my friends, but I am beginning to realize that I don't have a relationship with them at all. It's like we don't know each other, and when we don't live in the same area, so our friendship instantly fails. I think if I move back home and work for the  family business, I will be happier. I know my parents want me to go to graduate school and even pursue a PhD, but I feel like I have lost interest. I feel as though I should keep lying and keep going to make them happy. I am part of clubs and organizations on my campus, and I often go out alone because I don't have anyone. I just think I would be happier pursuing a career in the family business than my own path at this point.",1.0,5,0,5,False
93,loneliness,t5_2rlb9180nid3,Study Abroad ( Lonely in France),"So I moved to Dijon for my master's, from Dubai, which is actually my home, so I'm an Indian origin 26f moved to Dijon ,France and it's been nothing but lonely going from an insanely populated city to somewhere in the middle of France and I know French , however even then I seem to find it difficult to connect with people. 

Somehow I've always found it harder to speak to European people but, this one seems really hard on my mental health, because I'm living in a country that is so different to the one I was in before and add to that, the fact that I've  never lived alone and suddenly I only find myself lonely and eventually get depressed.

Can we please connect if you are also in France or even anywhere in the world? I really just need someone to have coffee with and chill around remotely have some good conversations.",0.75,4,0,4,False
94,loneliness,t5_2rlb91806nf2,I want to live,"I want to live. I want to move out of my parents house, I want to travel the world, I want to find my own style, I want to have friends I actually like and who actually like me. I want to date people. I want to read and gain back the pleasure I felt from it when I was a kid. I want to play sports. I want to do so many things.

I think it's easy to think my life, and thus the world, is about to end. That everything's said and done and that this what I get. That I can try again in the next lifetime. But that's not true. I'm only just starting. And god do I forget that but how badly I want to live and do things. 

I don't know what I want to be doing when I'm 50. Hell I don't even know if I want kids or not, and that's a big one. But I know I want to meet and connect with people. I want to go out with a guy and have his full attention. I want to have him fall for me. I want to be alone with him and for it not to be awkward. I want to have like minded friends who understand. I don't just want to be friends with people simply because they are close and I have to do with what I've got. I want to learn so many things and not rot in bed. I want to have the energy to do more and be more.

I am not exactly sure how I'm going to achieve any of this. I'm not even sure if this is achievable. Maybe I'm just chasing a fantasy. But God do I want it. I've been lonely for as long as I can remember. I haven't had a friend in years. I'm so tired.",1.0,13,0,13,False
95,loneliness,t5_2rlb9180a526,The years do not get kinder,"Has been 2 years and will be 3 in spring of 2024 since a Tornado known as Abigail came into my life and ripped apart what I thought could not be ripped up.

&amp;#x200B;

""It will get better"" I was told, but it never did, and I knew it wouldn't. I had dealt with this before, more than once unfortunately, only the immeasurably, serendipitous type of lucky find their matching pair on the first try, even rarer early on as teens or youngsters.  I knew the pain of heartache and each time before I knew it would take a LOOOOONG time, but I would get along  eventually.

&amp;#x200B;

But this time was different, and whats worse is I feel I lowered all my standards and personal rules to let this person in, and have been paying the consequences ever since.

&amp;#x200B;

&amp;#x200B;

The loneliness never stops, even when in company.   I fear this is how it's how it's going to be till the day my time clocks out.",1.0,6,0,6,False
96,loneliness,t5_2rlb91803yrr,"This community has helped lower my loneliness! Hang out, drink, smoke, play chess/other games with a diverse bunch of people from around the world in our Discord community. Come by and we can be less lonely together!","Discover a community tailored for individuals like us—grown-ups who are intriguing, perhaps a tad bit solitary, and like everyone else, are comfortable being on camera during our calls (it's a non-negotiable rule to ensure a worry-free environment). Hang out with a bunch of strangers who quickly become pals through video chats that run 24/7. We're all visible on camera, creating a genuine sense of connection! Feel free to [check out my profile](https://www.reddit.com/user/RobotsAreFriendsToo) for the D1scord invite link or other posts with the link. I apologize for any inconvenience, and while we're excited to meet new folks, this subreddit prohibits direct links.

Your first step upon joining: Navigate to the Rules-verification channel (top-left), scroll down, and give a single tap on the check mark at the bottom for access to general chat and entry-level video chats.",0.94,15,0,15,False
97,loneliness,t5_2rlb91804kkg,Birthdays,"Birthdays for me are the worst times of my life. I used to look forward to them as a child for the little parties and presents but now I genuinely feel such a sharp sadness knowing that my birthday is closer and closer.It started about 3 years ago when my family stopped celebrating my birthday, for context I’m 17 and in college (UK). They have had so many parties for others but for me I do not get any presents or even a party. At this point i don’t care about any presents I just want my day to be about me. This years birthday was especially bad. Sometimes when I feel lonely I get a weird pain/ache in my chest and fingertips , and for this year’s birthday that’s all I had . I also have this thing with 3 other friends where on our birthdays we give eachother presents we all contributed to. The thing is for when it was my turn I got nothing. They lie to my face and say it’s just long shipping but my birthday is in early august and it’s the 21st of November. I have largely contemplated what it would be like to Kill my self on my birthday, but what’s the point after you’ve already experienced the pain , could’ve just done it before it. But yeah that’s it pretty much just wanted to share how fucking bad I hate my birthday. I wish I wasn’t feeling so lonely at night haha.",1.0,12,0,12,False
98,loneliness,t5_2rlb917zwgsu,Tired of my presence taken for granted,"call it ""seeking attention"" or whatever you want but growing up most of us never felt appreciated so we try to seek validation as a replacement of ""love"", it's a never ending struggle",0.86,5,0,5,False
99,loneliness,t5_2rlb917zv8lw,Never had a partner,33M. The loneliness is severe and extreme.,1.0,6,0,6,False
100,loneliness,t5_2rlb917zjro6,27m looking for someone to talk to (more than 1 day if thats possible),"I am looking for people of a similar age (23 to 31) who have time to talk at least 1 or 2 times a week for 1 hour, either in writing or by any other means.  
  
I like to watch movies, especially drama, thrillers. I like different subjects, from psychology, philosophy, politics, history.  
I like alternative rock, dream pop, instrumental music, etc.  
I like football, the countryside, art in general

DM me",1.0,7,0,7,False
