,subreddit,id,title,selftext,upvote_ratio,ups,downs,score,Over 18?
60,loneliness,t5_2rlb9186ielu,I’ve been feeling lonely for 3 years and I don’t know what could’ve caused this,"I’m 17 years old and I’m lost in my feelings I don’t know if I’m truly happy or sad for something. I do have a few friends and one bestfriend that I follow with more but it just feels like it hasn’t been doing anything for me. I have been through a bit of child abuse like where my parents threw heavy stuff at me, screamed, yelled and hit me but I can’t just not love them you know it’s that kind of love where you dislike them but love them. I did used to like this girl but she pretty much destroyed herself and she doesn’t seek any help from it and acts like everything is fine in her life but I don’t know what goes on with her anymore I try not to think of her because I know I wouldn’t benefit from it just by thinking about it. I’m not the greatest in school because I know I could be doing something better but I just don’t know what that would be but everytime I try in school I just fall asleep and the teachers just email my parents that I’m asleep during their classes yet they wouldn’t ask me first if I’m okay or not or if something is bothering me. I did workout for a bit but lost discipline in that and was mad at myself about it. I did also use weed to fall asleep earlier for school but I got caught one day and my parents were upset with me. I just felt like I was nothing to them that day and was suicidal about it how I’m literally just failing school, doing drugs just to maybe better myself in school and have sleep in me, parents making me feel worthless when I do so much stuff for them yet they say I don’t do anything for them, how they say video games is a waste of time (which I don’t disagree with) but when it’s my reality escape and they try to limit me as much as possible from it. I’m just lost in my life and I don’t feel like I’m doing anything useful with my life. All I come home to from work after school is just verbally abused to when I forgot to do something when I got so much going on in my head that I can’t even keep up with my self. I’m just lost and lonely feeling.",0.81,3,0,3,False
61,loneliness,t5_2rlb9186kmkc,I can help you make friends.,"If you are Millenial or Gen X man, reach out to me.",0.25,0,0,0,False
62,loneliness,t5_2rlb9185v0hf,Loneliness is eating away at me,"I’m 20 Female, and I have never been in a relationship. I don’t talk to Men outside of my family &amp; work. I have never been intimate with any man. I didn’t really care at first and always told myself when I’m ready in my mid 20s, I’ll find a Man and get married. I come from a religious background so sex before marriage is forbidden. But recently it’s eating away at me, I feel so sad, isolated and touch deprived. I wake up, eat, work, eat, go sleep. I don’t have much friends but my life is like one endless mundane routine. I have social anxiety - so interacting with people is so incredibly difficult. I want to be able to have a partner so I can enjoy life with, travel with, talk to each-other about anything and everything.

I want to feel loved, and be in a relationship and eventually get married - I just have no hope for myself and I keep looking at other people who are my age in relationships - it’s makes me feel so miserable about my life.  I feel so unworthy, un loved and undeserving. My self esteem is so low, I question why any man would ever like me. I want to cry at how lonely I feel and sad I feel all the time, but I’m so empty inside. I want to get married and have children. But I lack so much hope for myself. I scroll on Pinterest looking at wedding dresses all day, wishing that one day I get the life I’m hoping for. But the more months go by I don’t even feel hope or excitement or any type of joy about life. 

I don’t know what I’m trying to gain by writing this post, but just had to talk to someone. If there’s other people going through the same thing.",0.91,9,0,9,False
63,loneliness,t5_2rlb9185o34d,I have a place if you're lonely,I made a server a while back for lonely people and its really grown into a supportive community. 330+ active members. If you need an outlet we are here to chat and become friends. Let me know if anyone is interested.,0.67,1,0,1,False
64,loneliness,t5_2rlb91854ipn,Social media is making us lonely.,"[https://www.enna-mind.com/post/exploring-depth-in-digital-connections-a-social-media-survey](https://www.enna-mind.com/post/exploring-depth-in-digital-connections-a-social-media-survey)

Social media is making us all lonely. 

  
We are building a new social media for people who want to take back control of their digital social life. **Enna** is designed to help users build strong, deep relationships with the people that really matter, instead of showcasing a curated image of a life of indulgence and laziness.

  
Want to be involved? Complete this [quick survey](https://www.enna-mind.com/post/exploring-depth-in-digital-connections-a-social-media-survey) to help us understand your perspective! 

We want to hear from you and build the platform that you want! Join us for this exciting journey!!",1.0,3,0,3,False
65,loneliness,t5_2rlb9184qeqh,Estoy completamente deprimido y nadie lo sabe.,"Sufro un caso terrorificamente grave de depresión funcional.

Mi situación me ha llevado al extremo de convencerme a mi mismo de que no necesito ser feliz para sobrevivir. 
Soy un hombre de 30 años. Estoy solo. Nadie tiene tiempo ni deseos de escuchar la tristeza de un hombre adulto y solo.
Tengo sentimientos encontrados frente a mi misma vida. Tengo un buen trabajo y no tengo ahorros significativos, pero me doy a mi mismo lo que quiero. Sin embargo tengo que trabajar 6 días a la semana jornadas de 10 horas en una labor para la que soy bueno pero no me hace nada feliz, pero que más dá? Si abando o mi trabajo moriré de hambre y nn podré pagar una renta. Trabajo de casa así que no tengo tiempo de socializar ni hay alguna persona especial en mi vida. 

He descubierto que estar solo durante largos periodos de tiempo se siente bastante parecido a estar muriendose. Así me siento. No estoy viviendo como tal. Estoy muriendo lentamente, día tras día se me va la vida en una nada tras otra hasta que se acabe por completo y muera...

Tengo un círculo de personas con las que me relaciono. Son mis compañeros de academia de artes marciales. Sin embargo ellos no saben lo que me ocurre. Para mantener a las personas cerca de mi tengo que mostrarme siempre muy positivo y optimista. Cuando la gente te ve caído suelen alejarse de tí...

Yo soy mayor en edad y también en talento de combate, lo cual ha generado una relación de jerarquía entre nosotros y ahora es más inapropiado que ellos me vean mal o sepan que estoy vulnerable... En mi familia es igual. Todos me identifican como un tipo súper apegado a su trabajo. He podido ayudar a mi hermano y a mis padres con mi salario... Cómo se sentirian ellos si supieran que en realidad soy profundamente infeliz?

No hay nadie en mi vida con quién pueda desnudar mi alma y mostrarme vulnerable. Si no soy un héroe estoico y capaz de hacerlo todo, terminaré por perder a los pocos que me rodean.",1.0,6,0,6,False
66,loneliness,t5_2rlb9184eh54,Drinking in the car alone,"Hi I have lost the pleasure of going to pubs and restaurants alone (plus it is expensive) so what i found good is to sip some beers in the car with some music (did it on a Friday eve, how sad ? ). I want to know your opinions and if you can relate share your experiences. Thank you. M 29 here. ",0.87,11,0,11,False
67,loneliness,t5_2rlb918440yy,This is not romanticizable,"Loneliness dries you slowly. The year is about to end and I'm feeling like a failure. I don't even know what my next step will be cause I find myself on my own. Literally nobody is there. And that kills you. You need people to support you. None of the guys that I met stayed. My friendships always leave me. Is weird cause anyone would say that I'm beautiful and smart but dang I couldn't even take adventage of that. I don't have idea of what I'll do now. 
This is hell really. I genuinely thought that I could get better but ya know fucking luck.
The weather doesn't help it's been raining the whole day. And I don't even have no one to text.
I want to go to hell and met people who doesn't have a previous idea of what I am.
My hope is to leave to see new lands and earn experience. I just feel sad cause I feel so dumb cuz I don't think I deserve any of this. I just couldn't prevent it.",0.94,13,0,13,False
68,loneliness,t5_2rlb91844ajg,About to turn 17 and I'll be alone,"I just want to hide by that day I don't want anybody to see my face and think kind of a sad sight.
If I have ""everything to be happy"" young, pretty and smart. Why it doesn't work out?
🏜️ 
The next year gotta be different God.",0.83,4,0,4,False
69,loneliness,t5_2rlb91843xal,"Angry, sad, empty, lonely","I'm am a 18 year old man who had just graduated back in June I doubt anyone will see this but I tell my story, back during covid my great grandmother had passed(she was my real caretaker instead of my mother) and I have never felt the same, everything in my life was good, I did excellent in school. Now I never talk to anyone out side my house and even then nobody would talk to me, I was bullied for being weird in my early life and rejected by most and even myself now. Now all I do in life now is go to college, work but in dont do anything more than that. I masturbate and play video games when I'm not out and I'm sick of it I'm just so tired of doing it and everything in my life, I dont want those things anymore but I cant stop. I think I'm sexually confused and don't care who I love but I think I'm just so, so lonely that and missing something apart of me. I would do anything to be with sombody, be loved and Given attention, I feel like as a man I'm weak and I KNOW that is not ok, I want to be strong, dependable, cool, loved. I just get so mad now and I cry myself to sleep constantly thinking about not being lonely, it is of course a dream I feel I can never reach, I try to interact with other but everyone is busy which is not their fault people have their own lives and that's ok. I've been in therapy since I was five due to my high level of anxiety mixed with the devil that is ADHD. I want to destroy everything around me into pieces. I want to die painfully so I can feel the sweet relief of death sometimes. I've been put in a mental hospital when I was ten because I wanted to end my life and of course I don't want to think that way anymore but I can't help it, I'm such a disappointment to this world and people that have had it worse then me are still going and I makes me feel even more weak and hopeless.

Thank you for reading if you made it this far have a wonderful day.",1.0,2,0,2,False
70,loneliness,t5_2rlb9183rcpx,Loneliness,Do you ever just reach for your phone only to realize you have nobody to text or is it just me? I used to have friends but they're all gone now and I don't know what to do. 🧍,1.0,6,0,6,False
71,loneliness,t5_2rlb9183md65,How does it feel to emotionally/mentally matured at a young age?,,0.91,8,0,8,False
72,loneliness,t5_2rlb9183ocry,Loneliness survey,"Hi!

I am currently studying Industrial Design in Wuppertal Germany and for this semester we are developing products in coorperation with the ministry for education and research designed to combat loneliness. For our research we made this survey on loneliness that takes about 2 min. to complete, your help would be greatly appreciated! [https://docs.google.com/forms/d/e/1FAIpQLSedb5x1mM45xffx\_bTcfPX\_E\_WkE1cbw6eTllse5VT2-ODe8Q/viewform](https://docs.google.com/forms/d/e/1FAIpQLSedb5x1mM45xffx_bTcfPX_E_WkE1cbw6eTllse5VT2-ODe8Q/viewform)",0.33,0,0,0,False
73,loneliness,t5_2rlb9183g2di,Hello,I think I might kill myself soon,0.86,5,0,5,False
74,loneliness,t5_2rlb9183aq0x,Well they said look for online communities So here I am. Hoping to connect with people.,"My kind of loneliness is I know a lot of people but no one knows me. I have friends, but they wouldn’t reach out unless I do. Sometimes I just wished someone would reach out and say hey what’s up how have you been or hey would you like to hang out. I Live in NY and I am open to making new friends and hopefully hanging out in person with them. I’m gonna be reaching out to a lot of people in this community and hopefully we can cure our loneliness together!

About me:

- I am an aspiring software engineer

- I play Video games (League of legends, Genshin, and many more)

- I love music

- I’m into Formula 1

- I love audiobooks

I’m excited to connect with fellow enthusiasts and make lasting friendships. Feel free to drop a message if you share any of these interests or if you just want to chat. Looking forward to connecting  with new people and creating memorable experiences together!",0.86,5,0,5,False
75,loneliness,t5_2rlb91832ylf,Finally found a nice place to make friends!,"There is a club for people just like you and me: adults who are interesting, maybe a bit lonely, and like the rest of us, who are willing to be face-on-cam in our calls. (Sorry, it's a firm rule; this way, people don't worry about who is looking at them.)  


Hang with a group of strangers who become friends in video chats that are open at all hours. We all are on camera so you feel like you're really with people!  


Please click my username for the D1scord invite link in my profile or for other posts with the invite link.  
I am sorry, I am not trying to make you jump through hoops, and while our club loves meeting new people, and most who join love us and stay with us, this subreddit doesn't allow links.  


First thing to do when you join: Hit the Rules-verification channel (top-left), and scroll down, hit (just once) the check mark at the bottom for access to general chat and the entry-level video chats. ",0.93,13,0,13,False
76,loneliness,t5_2rlb91839owc,I feel lost,"for months ive been feeling a deep hole in my chest, a feeling of worthlessness. ive pushed away the people i care about the most in an attempt to prevent myself from hurting more. i tried to accept it but when i see them why does it still hurt even though i said i dont care why does it still hurt if it didnt matter why why oh Lord must you put me through this pain i hate myself nothing i ever do is good i hate myself so much",1.0,4,0,4,False
77,loneliness,t5_2rlb9182zlmz,I feel lonely and friendless,"Hello, I’m a 19M freshman in college. At the beginning of the first semester everything was going well, but then I started to experience extreme social anxiety and depression, which led to me distancing myself from the few people I was talking to. I found myself sitting alone all the time, not speaking to anyone. As a result of me being alone all the time, my depression was getting worse. I feel extremely alone, especially now that my best friend got a boyfriend and she has been hanging out with him more than me. Don’t get me wrong, I am happy for her but I can’t stop feeling like I’m getting replaced. She was the only person I told everything to, the one I laughed with the most, we have many inside jokes, etc… and to feel like they’re taking her away from me just hurts. It may sound selfish, but that’s just how I feel. I guess feeling like this is my fault because I did this to myself. I distanced myself from everyone else. If anyone wants to become friends, feel free to say something :) (this is my first time using Reddit so if I did something wrong my apologies.)",1.0,11,0,11,False
78,loneliness,t5_2rlb9182zvwk,I feel worse and worse.,"I am 15. I live with my parents only. I have a sister and brother. I had pretty close relationship with them untill they moved out. My sister wanted to commit suicide. My parents are strict and religious. I know that (almost) every parent love their child but the words that they say to me are really hurting me. They told me that am worthless, telling me to fuck off, or making me say sorry for something I didn't do. Some time ago I found out at the doctor that am physcially ill and need rehabilitation and stuff. I started talking to imaginary friend around 1 year and some months ago. I know that he don't exist but it's like I feel that he is a real person. Some time ago I cut myself. I don't know why, it was like feeling literally nothing. I never told anyone about this. Thanks for reading.",0.8,6,0,6,False
79,loneliness,t5_2rlb91834ivm,Modern Loneliness: A series exploring the loneliness epidemic,,1.0,2,0,2,False
80,loneliness,t5_2rlb918313qi,Female help needed,Need some real women to let me know wtf is wrong with me.,1.0,1,0,1,False
81,loneliness,t5_2rlb9182o7vl,Feel like outsider sometimes,"I think I don’t have really Close friends. I have beautiful coworkers and I love to spend time with them. But on the weekends we almost never communicate. Everyone has their own life, friends, relationships. I have only them, and there is no place for me in their lives. I am an ambivert, I love talk to people, meet them, but I don’t know how to do it on purpose. I am interested in many things, if i feel comfortable I can talk about anything! But I don’t know how to meet someone. How to build my own life. I also have depression, so sometimes it’s hard for me to initiate communication even with closest ones. Honestly, there is so much love and will to support inside of me, i think i can be good friend (but not with anyone). I love to listen so much. Talk about someone’s feelings and problems. And I want to be friend with someone like me. Interesting (for me), supportive person. I don’t have anyone to write when I feel really really bad and lonely. But I appreciate when people do that to me. 

It’s hard to spend all your free time only in your own company. You can have so much hobbies but there is no sense in it if you don’t have anyone to talk about that or spend your time together doing or learning something!((((( Or just laughing and doing wild sh*t :))

Any advice how to meet friends? Irl or internet, doesn’t matter",0.88,6,0,6,False
82,loneliness,t5_2rlb9182lqge,26m and I've been used a lot,"I've been used a lot and secluded myself from a lot of people . Which landed me here. Put up boundaries and , well I don't know, did I hurt myself? Wish I could find anybody that would just like you for you. Its extremely hard. I would like input.",1.0,7,0,7,False
83,loneliness,t5_2rlb91824e2d,I need someone to talk in dm,I'm feeling really bad. I'd love to talk to someone in private. Please DM me if you don't mind,0.81,3,0,3,False
84,loneliness,t5_2rlb9181uay6,"Somedays, I don’t even talk","It hasn’t really hit me until now, but I dont even really use my voice to talk to people any more. I just wake up, go to the bus, go to class, come back from class, study and go to the gym. I haven’t had like a real conversation about anything in person. Its gotten so bad that when I do try to talk to someone, my voice will just crack and be quiet. Tbh I’ve been told my voice is quiet all my life. Whats the point of having a voice if i’m not going to talk at all. 

I realize I’m the problem however. I understand why nobody wants to be friends with me. I am just a boring person, have extreme trouble picking up social ques and am just extremely awkward in general. I haven’t had a real friend since middle school and I’m now 20… I’m quite jealous of people I see laughing outside with friends. This jealousy turns inwards into anger over my inability to make friends.

I just wish I had real friend to talk to and someone that wont judge, make fun of or bully me.

Anyone else can relate to this?",1.0,25,0,25,False
85,loneliness,t5_2rlb9181q714,I feel have no close people in my life and it's slowly killing me.,"Before i had only one close friend, but he moved on so i was left alone again. I can't recreate that bond with anybody. I talk to people but only from time to time and on very basic shallow level. I feel like i have deep hole in my heart and no matter what i do i just can't fill it up. It physically hurts me.",1.0,14,0,14,False
86,loneliness,t5_2rlb9181raoo,"Get rid of the loneliness the same way I did! Hang out, drink, smoke, play chess/other games with a diverse bunch of people from around the world in our Discord community. Come by and we can be less lonely together!","Discover a community tailored for individuals like us—grown-ups who are intriguing, perhaps a tad bit solitary, and like everyone else, are comfortable being on camera during our calls (it's a non-negotiable rule to ensure a worry-free environment). Hang out with a bunch of strangers who quickly become pals through video chats that run 24/7. We're all visible on camera, creating a genuine sense of connection! Feel free to [check out my profile](https://www.reddit.com/user/RobotsAreFriendsToo) for the D1scord invite link or other posts with the link. I apologize for any inconvenience, and while we're excited to meet new folks, this subreddit prohibits direct links.

Your first step upon joining: Navigate to the Rules-verification channel (top-left), scroll down, and give a single tap on the check mark at the bottom for access to general chat and entry-level video chats.

 ",0.92,10,0,10,False
87,loneliness,t5_2rlb9181yfhj,Dreams of a Life,,1.0,1,0,1,False
88,loneliness,t5_2rlb9181fxsg,It’s not just loneliness. It comes with the feeling that I’m fundamentally unlovable and nobody would miss me if I died,"The sooner I accept this, the sooner I’ll spare myself from agonising pain every single fucking day. 

The question is, how the fuck do I accept it? I just want to be free from this pain.",0.95,18,0,18,False
89,loneliness,t5_2rlb9181arw4,college life Sucks,"I'm a 1st year college student. I was not able to get into my dream university ...i just can't bear to look at my parent's disappointed face. They never said anything , but i know deep down they are as hurt as i am. I'm in an average college pursuing my bachelors degree. 

I thought that everything will be normal when i start going to college. But it has made me even more depressed

The starting days were good. Not many students came in the first week as many students live out of the city. So i made a friend. We both hung out with each other and all. Then more students came and we made more friends. 
It was going great for the 1st month but then things went downhill when i went to a family function for a week. When i came back, i felt like i was not part of their group. They were having their own inside jokes, privately messaging each other, and all. I tried to ignore it at first but then i couldn't take it anymore. Then in the lab class, i was completly heart broken, the profeesor told us to make a group of two to perform experiments, they made groups on their own and left me out. I just felt like shit. 
Then many more incidents happened when i felt like i was the last priority for them. 

I tried to look up to google about what to do, it suggested to meet new people and all. I'm not an introvert nor an extrovert. So i seriously tried to connect with new people. But now i feel like the result is same. I don't know what is the problem with me. I'm feeling anxious everyday. Especially when no body ever calls me like they do to others.",0.9,8,0,8,False
90,loneliness,t5_2rlb91818b5u,More and more alone,"I'm really sinking into depression. I feel like I'm becoming increasingly isolated. 
In high school, I had a lot of friends, but drugs destroyed everything, and I ended up in a psychiatric hospital. Then I got a second chance in art college, made lots of new friends, had a super interesting life, but again, due to drugs, I lost them. 
Then, the combination of Covid and depression led me to drop out of college. Now, at 26, I've completely turned my life around regarding drugs and destructive behaviors, nearly two years clean, regularly attending Narcotics Anonymous. I've seriously started working in the restaurant industry, stabilizing my life. But, I don't know, there's no one around me. I know a few people, but either they're completely wasted, and it's unpleasant to hang out with them, or they have a healthy life but don't share my interests in art and music. I don't see how I'm going to meet people, especially since meeting others shouldn't be a project or a goal; it should be natural. It frustrates me to have to think about 'making friends.' Just the idea of going alone to a concert, for example, to try and meet people while pretending not to care, depresses me. Anyway, it felt good to write this!""",0.75,4,0,4,False
91,loneliness,t5_2rlb91818oqf,Hell,"It's been 10 days of no-contact. I don't know for what reasons i made a tinder account, maybe to find a friend ig but last Monday i got matched with a girl who's like really similar to me. Like we have similar music taste, we talk the same manner, we both had our tough times and she's good to me. I always have this difficulty to trust someone because i fear that maybe that don't feel the way i do when we're making a conversation and maybe they are just passing their time with me. I feel a little this way with this new girl im seeing. No doubt she's sweet and makes me feel heard. The thing is that can someone please tell me if im doing right or wrong. My ex told me that she's been going on dates and maybe that triggered me as i didn't had anyone to go out. I am still grieving the loss and for whatever brutal stuff she told me, i don't miss her the same way i used to in the initial days of breakup. This new girl is really supportive, she was too but idk if i should go for it or not. I still can't sleep properly, i miss those days, those times. What should I do?",0.75,2,0,2,False
