,subreddit,id,title,selftext,upvote_ratio,ups,downs,score,Over 18?
32,loneliness,t5_2rlb918c07nu,They reached out,"A couple days ago i was spending time with my new date that i think was right for me to go out with. We were talking and my ex texted me that she saw brownies that i used to bake for them and apparently they didn't knew the temperature and timing so they texted me to ask about it. I was busy so i texted her that I can't remember and please refrain from texting as I'm with someone else rn. They started showing that behaviour that they used to project that ""im sorry what? Do you think that im trying to woo you or anything?"" And stuff which was really weird to process. Did i do anything wrong? Why should i feel all the guilt? It's not like i didn't wanted for em. They literally said that we should meet and indicated that they are thinking of re-establishing the relationship again but they didn't came nor replied. As i figured that no answer is an answer too so i moved on, putting a heavy rock on my chest. Was it right of me to do all this?",0.5,0,0,0,False
33,loneliness,t5_2rlb918bx50h,Stuck,,1.0,1,0,1,False
34,loneliness,t5_2rlb918buwsb,"38/M looking for a freethinking woman, platonic only : Secular, Libertarian, Skeptic, Humanist preferred.","Hi, I am a 38 M looking for a woman who meets the above criteria or atleast comes close. I really don't want to fight with anybody and don't want any negativity. If you meet the specifications, please get back to me. If you don't, that's fine : peace and love to you anyway.",0.67,1,0,1,False
35,loneliness,t5_2rlb918bo0a5,Weird Method,"I did something really weird today. I was really scared and was about to have a breakdown, all alone. So just to stop it I just put my forehead on a wall, just to try something different. And it worked. I was calm in about 20-30 seconds. Don't know why, but it worked.",1.0,2,0,2,False
36,loneliness,t5_2rlb918bcgil,No real friends,"Why is it always me? Why does everyone leave me? Why do i make friends but after sometime they just abandon me? Is it because I'm ugly? Nerd or what? I know i'm not but still. I don't want friend who only shows up during exam season. 
Today was our class test. No one sat with me in the 1st period but in the next period they all were fighting to sit behind me and acting all friendly with me because of test. 

It feels like if i don't start a conversation with them.l they won't even care that i'm there or not. 
I just want someone to be there for me. Someone who waits for me after the class is over, not leave me behind, sit with me. 
It hurts to sit alone When your so called friends are having fun. 
And the irony is I'm the one who approached them first, i'm not saying it in a wrong way, but still when i compare it with the sitaution few months back it feels like shit. So it feels like the employees fired the ceo of the company. 
I tried to make other friends but nothing seems to work for me. I'm everyone's last priority. Just feeling so lost and anxious right now",1.0,6,0,6,False
37,loneliness,t5_2rlb918b2p58,I saw a woman and really liked her but came to know that i can never have her,im feeling really uncontrollable feelings of jealousy and sadness inside me and just want to disappear from this world i wish i had that superpower but i dont how can i live like this with all those feelings inside me? its just very hard and every time that woman comes into my mind it's eating me inside out what can i do to divert myself from those feelings?,0.92,10,0,10,False
38,loneliness,t5_2rlb918b8aiz,Spending Christmas alone.,Anybody else spending Christmas alone? Thinking of camping up in the mountains for a couple of days and going for long walks.,0.75,2,0,2,False
39,loneliness,t5_2rlb918aycii,Destroyed and Heartbroken,"I feel deeply abandonded. My ex recently left me and just moved on like nothing. When I finally got to see her, she looked at me like if we were never best friends, soulmates, there for each other during the best times.
I am broken. 
I feel so alone. I am M 27 and most of my friends have already gone on their own ways to lead a successful life.
I am trying to finish my degree.

I have no one and she is the only person I was able to be happy with.",0.9,8,0,8,False
40,loneliness,t5_2rlb918b3t0d,I don't know what I'm feeling I have friendsish in school more or less acquaintances I've made more acquaintances when I started smoking pot but I have no real friends that I hang out after school or in the summer and do shit with.,,1.0,2,0,2,False
41,loneliness,t5_2rlb918az5hm,Oh so we're strangers now?,So recently I started talking to this girl and my school and I really liked her beauty and I admired her and I wanted to be friends with her right so one day she gives me her Snapchat I think if you have read the story that I posted a few months ago about the Snapchat incident and we got into a fight and it was not only one but it was two times so what happened was me and that girl wasn't really close right but we were friends to be honest we talk everyday we text on Snapchat we sometimes hang out together if it's possible but yeah so one day in a fight she tells me oh all the boys used to hit on me last year you don't know that cuz I don't know you and you don't know me and I gave her credit cuz you know that's true I don't know her I just came to the school and she doesn't know me which is true but then she says oh we're totally strangers to each other wow we're not even friends like she keeps saying that and then I'm like how are we not friends that we've been talking for the past few days we've been hanging out we've been texting each other how are we not friends so like we're strangers now we're strangers now okay so we're strangers now like okay y'all give me your honest opinions I want to know if I'm tripping but if you talk to someone probably everyday you text them you're there to listen to them you hang out is that not called friends I really want to know because I want to know if I'm tripping like she over here talking about oh you don't know me I don't know you were strangers to each other we're not even friends bro I got to screenshots of us talking don't even trip right now like...,0.6,2,0,2,False
42,loneliness,t5_2rlb918b2urh,Anyone wanna hop in a group discord and talk?,I’m coding right now but if anyone wants to talk or anything I’m down to talk,1.0,1,0,1,False
43,loneliness,t5_2rlb918aeeec,Why do I not have friends?,"I am kind, talented(I play the trumpet, piano, bongos, basketball, and baseball), smart, knowledgeable, and funny(these were all words used to describe me by other people), yet I have no truly close friends. I am starting to see a lot of signs of loneliness and even a couple signs of depression. I don’t know why no one talks to me even though I like talking to people and all my teachers enjoy talking to me, but not one of my peers has had an actual conversation with me in a long time. I don’t know what to do to help me get closer friendships. I even made two books about the universe and earth and all I got was a thank you. No one asked why I made them or even talked to me. Just please, does anyone have any ideas?",0.86,5,0,5,False
44,loneliness,t5_2rlb918a4wx2,Hey I am 23M from India and I severely feel lack of a female presence in my life. I just really want to have a female bestie but I don't know how to make one.,And I do have few friends who are guys but Idk I still feel that lonliness.,0.45,0,0,0,False
45,loneliness,t5_2rlb918a1bp7,Discord,Hey anyone on discord interested in joining a discord server for lonely people to connect?  Be 21+ [https://discord.gg/K7FJuAwNep](https://discord.gg/K7FJuAwNep),0.5,0,0,0,False
46,loneliness,t5_2rlb9189p0rj,Facebook showed my memorfy from 8 years ago where I was writing about how I can't find a girlfriend. Still didn't have one.,"It made me think how many years passed in this way. 8 years only from that memory but also years and years before. All my life of 35+ years. Never had a significant other, and probably will never have. It's very sad and depressing, when you know that nobody loves you, nobody will be here when you are sad, always coming to quiet lonely house, never cuddled... Can list it forever.

Back then I was sure that I'm more likely to start a successful company and become rich than to find a gf, and while I didn't yet start a company, I published a book, moved abroead and became a member of district council (abroad!).

It sucks. I seem to fit into all those boxes which they list ""before having relationships you shoulld blablabla..."" but all my dating attempts were a failure. I failed in this part of life.",0.83,4,0,4,False
47,loneliness,t5_2rlb9189j1l0,I'd kill for a damn phone call,"I text my mom, no response.
I text my dad, no response.
I call/text my sister, says she's busy with kids to have a quick chat not even 5 minutes ( been her exuse for 12 years)
I text my boyfriend no response, so I decided to call just to be told he doesn't care because I dont do things he like anymore and I complain too much (IVE BEEN WORKING 2 JOBS FOR 1 1/2 YEARS)

Just left with this pit in my chest just staring at my phone hoping someone replies. I just want to talk about my day feels like I haven't had a good day in years but today was different. I just wished someone was here to tell them. 

All my excitement and happiness extinguished in the span of 10 minutes. When I felt my smile turn into a frown, it killed me. 

I don't have friends, I tried to make some but I guess I'm not likable or annoying I honestly don't even know what I'm doing wrong. The few people I got in my phone are just coworkers (we are friends at work but outside I might as well be a stranger they never met) 
 
What's the point of even trying to find joy in life when loneliness is there to shatter it.",0.85,9,0,9,False
48,loneliness,t5_2rlb9189lyzt,How did I get here,"
You know how it seems like there’s one person in every family or group of friends that is permanently single? I never thought it’d be me, but here we are. I’m 31F and am slowly losing hope that I’ll ever find somebody to love and be with. Why am I like this? What’s wrong with me? 

Rhetorical questions. Just needed to type it all out for strangers on the internet to read because apparently that’s how lonely I’ve become",0.6,1,0,1,False
49,loneliness,t5_2rlb9189hust,I'm not sure what's wrong with me,"I'm sorry for the rambling I just have so many thoughts that I can't get straight and this small paragraph barley covers it all but I appreciate everyone who reads it. I'm not really sure why I'm posting this but I'm hoping that maybe telling others my story might help me feel a little less alone. 

So I've recently gone through a divorce. We had 
been married for 5 years, had 2 kids and she cheated on me with multiple men. We are currently living in separate homes and have moved on, I no longer love her I don't even harber anymore resentment towards her only a desire to cut her out of my life as thoroughly as possible. Here's what I can't understand, im seeing a sweet beautiful woman right now who loves me and my kids, she's my dream woman but I still feel so lonely and depressed. everything is as good as it can be but I still feel so alone. I'm in a big house laying in my bed watching Instagram reels to kill the time. There's 1000 things that need to be done around the house but all I can do is wallow in my bed with 5 different bags of chips and Oreos and cry. I want to ask this girl if I can come over but I'm not sure if it would make me feel any less lonely. At the end of the day I still gotta come home to an empty house. Every other week the kids are gone and even when they are here, I mean, they're kids, I lovem but the oldest is 5 it's not the same as adult company and taking care of 2 kids is so much harder alone. I'm in the military and living away from home so i have no friends here at least none I can talk to about this stuff. Ultimately I miss the family I had  but I know i can't have it back nor do I want it because I wouldn't want my ex back, I wish i had chosen someone else but I can't change the past. there's no one for me to talk to about any of this except my therapist. I'm really hoping I just don't wake back up. this loneliness is painful. this hurts more than anything I ever felt before. This wagon is no longer rofling ",0.75,2,0,2,False
50,loneliness,t5_2rlb9189entm,"The only thing I need to replace humans is drugs. They don’t lie to me,they don’t let me down. I truly hope the 250mls of methadone I’ve drank kills me. I do not have a hope of finding a home. I want to sleep forever. I hope this is goodbye.",,0.8,3,0,3,False
51,loneliness,t5_2rlb918999ie,Seeking Anonymous Company,"I am going through a difficult phase in life. Away from family and pets, loneliness is getting to me. Feeling very selfish when I write this but having anyone to chat with would surely make me feel better.",1.0,1,0,1,False
52,loneliness,t5_2rlb9188wk46,Anyone out there,Anyone out there to chat. Feeling a tad low. Trying to distract my mind. Anyone else feel the same out there?,0.84,4,0,4,False
53,loneliness,t5_2rlb9188iu6h,PLEASE HELP...I DON'T KNOW WHAT TO DO ANYMORE,"Is any one struggling with their mental health and really want to overcome it with all their might ? Like I'm really trying but I just feel so alone in this world. It just feels like we live in such hedonistic and individualistic world and sometimes I just find it hard to see the light. I try to find connections with people but honestly I just feel like no one cares, and life starts to feel mundane/repetitive. 

&amp;#x200B;

I try to be happy, I'm honestly trying, God knows (because I have so many good things in my life) but I try to look into the future and wonder is this it...Ok I become a doctor (I'm a female medical student btw) and then what...I'll spend my life working and working. 

&amp;#x200B;

I have no friends (barely), no past-time ( used to be a movie fanatic but it started to impinge on my mental health so I halted it, I also overcame my porn-addiction... THANK GOD ), I have numerous ambitions, drive and goal (I'm extremely goal driving) but then when I achieve my goal I have no one to share that joy with...Just me to tell myself well-done (then move on to the next goal) no one to share my dreams and vision with, it feels like it's just me and God. I really want to find someone who I can care for and support their dream but also someone who cares deeply for me and can support mine too. 

Sometimes I wonder if I'm just rambling and I need to get over-myself or my monoamine neurotransmitters are playing with me. I have immigrant family whereby 2 of my brothers are surgeon , my sister is a lawyer (with 3 degrees and a masters degree on top of that) and my third brother is an engineer (also with a master in aerospace engineering) and mother who worked her ASS off to provide a bright future for all 5 of us , so sometimes when I share my mental health problems I can tell they don't get it....although they try their best to be sympathetic. They don't understand because I was born and raised in a 1st world country with everything in a silver plater .. 'so why aren't I happy?'....'what's the matter?'...'Is there something wrong with me?'....'I'm I just an emotional girl'....'I'm I ungrateful and entitled?'....'Why should I yearn for a strong bound or relationship with someone?'...'I'm I asking for too much?'

&amp;#x200B;

I don't know. Someone help me please. I've tried seeking help from so many people..my family doctor, 3 therapist, and university counsellor and although I have gotten better significantly surprisingly (trust me I was ALOT worse), I still feel like something is missing. ",1.0,6,0,6,False
54,loneliness,t5_2rlb9188nqhk,I'm lonely but I don't feel like it?,"I know feeling lonely is entirely an emotional state and you can be lonely and still have lots of friends, you can not be lonely and have next to 0 friends, etc. So I get that I'm not lonely because I don't feel it. 

But like, I think im exhibit a lot of symptoms of being socially isolated imo. I make up people in my head that I talk to for hours and sometimes I forget they are not really there. When I got a bowl of chips the other day, I made a second one for the person I was talking to. 
Sometimes I catch myself in a pretend world and I try to get myself out of it, by pinching myself, taking deep breaths, looking around but it doesn't work. 

Maybe they are not signs of loneliness at all but they sure do look like it. I'm sure I don't FEEL lonely. 
Definitely looking for advice not just a vent. Just thought I would turn to the internet before considering a scary therapist or something",1.0,2,0,2,False
55,loneliness,t5_2rlb9188iihc,What to do,So much going on around. Nothing my way. I feel like I'm about to explode,1.0,3,0,3,False
56,loneliness,t5_2rlb9188hv5t,Sharing my experience and battle with loneliness,"Hi all, 28 years old (F) after 4 years of therapy and losing and gaining friends I wanted to share my experience. I have never felt lonerier in my life despite having an interesting career and boyfriend, and 2-3 good friends. I  have never been the most sociable and as a kid I always felt that couldn't belong. Girls didn't like me and boys were making fun of me. As a young kid and teenager, could not comprehend what was wrong with me, why did I feel so lonely around people. With the years, I got shy and closed off but learned how to trust and connect when I decided to overcome my fear of socializing and moved abroad for studies. I remember how scared and excited I was. For few years, I felt the sense of belonging, I lived in a lively city and made good friends and people with whom I could connect and share experiences but also life in a way as we were all young students away from home and this common experience bonded us. Fast forward to some years later, I changed 3 different countries and now I have settle somewhere where never thought I would be for more than 1-2 years. I started getting shy again, and all of the things I hated about myself (my lack of social skills or autism? not sure) came back to haunt me. I got scared that I am reaching 30 and will end up alone. I always had people to go out, and I partied a lot but none of these things really fulfilled the void in me. I started thinking about my family and how I missed being with them, but I knew that I chose this lifestyle for a reason, and I shouldn't be afraid to experience life. I met my current partner with whom we live together but we are fundamentally different, and this started having an impact in my life as he is extremely outgoing and always wants to be around people and talk for hours. I cannot do that as socializing is exhausting me after 2-3 hours. I like being alone, but I feel lonely because I am surrounded by people who do not really understand me. I just wanted to share my experience and hope that I am not alone in this. I many times wondered if it's truly me, and there's something I should change about myself. When I am around people, I enjoy it but then I get exhausted and want to come home to watch my shows, read a book or play with my cat. I believe that having a partner that understands that is important because mine has been harsh and judgmental and arguing with me that I have defeatist attitude and that to not be lonely I need to just start doing activities. I crave connection but I also don't know how to approach people. I tested for autism and got high probability of developing one. I am always worried not to say weird things because of previous experiences I had in which people called me weirdo and autistic. Since I moved with him to suburbs I have spend most nights home alone. I have tried to make friends in the new country but unsuccessfully. I feel that I need to break up because this is not the person that gets me but then I am afraid that there won't be anybody else and will be alone. Has anyone else experienced this fear and level of loneliness? ",1.0,3,0,3,False
57,loneliness,t5_2rlb91883p1f,After 11 years of self reclusion I am starting to feel desperately lonely in terms of dating,"I am 30 and still virgin. I long for the company of a female... For so long. I never had depression because I am strong and tough. But even though I am starting to feel the symptoms of depression due to the long term loneliness. I don't cry easily. My mbti type is INTJ and I'm a virgo. I just never had friends per se, but I had one girlfriend 13 years ago but no sex. I'm still a virgin. I wish I can turnover this or else my tendency to become misanthrope might have a blast which would direct my carreer on AI and quantum computation for negative influence on all humanity",0.9,7,0,7,False
58,loneliness,t5_2rlb91877rzk,"Get rid of the loneliness the same way I did! Hang out, drink, smoke, play chess/other games with a diverse bunch of people from around the world in our Discord community. Come by and we can be less lonely together!","Discover a community tailored for individuals like us—grown-ups who are intriguing, perhaps a tad bit solitary, and like everyone else, are comfortable being on camera during our calls (it's a non-negotiable rule to ensure a worry-free environment). Hang out with a bunch of strangers who quickly become pals through video chats that run 24/7. We're all visible on camera, creating a genuine sense of connection! Feel free to [check out my profile](https://www.reddit.com/user/RobotsAreFriendsToo) for the D1scord invite link or other posts with the link. I apologize for any inconvenience, and while we're excited to meet new folks, this subreddit prohibits direct links.

Your first step upon joining: Navigate to the Rules-verification channel (top-left), scroll down, and give a single tap on the check mark at the bottom for access to general chat and entry-level video chats.",0.88,6,0,6,False
59,loneliness,t5_2rlb9186jpti,WTF is love anyway,"My whole life I thought that somebody would see me for the good person that I am and fall in love with me.  I hoped they would see the good person that I've become.  That they would see how I take care of myself and the people I love.  Then they would appreciate me and want to be with me.  I built my life around that notion.  Literally every aspect of my life was built on becoming such a good human being so that somebody would see me, the real me, and fall in love with that person.  How could they not?

I grew up in a family full of wretched awful people.  I made it my life's goal that I would not become like them.  That I would do everything in my power to break the cycle of being hateful and petty.  I would be different.  I would lift people up instead of kicking them down.  I would praise them instead of insulting them. I would be there for them when they needed a hug, I would not avoid and abandon them in their time of need.  I would become reliable, loyal, and trustworthy.  I would not lie to them for my own personal gain.  I would be present in their life and not tell them to fuck off if I was busy with my own shit.  I would listen.  

I was hopeful.   

Once upon a time, I was hopeful.  I don't know what I am anymore, or who I am becoming.  I don't know what goals I should be aiming for.  I'm lost.  

Nobody sees me.  Nobody understands me.  Nobody cares.  Not really.  

So wtf is love supposed to be anyway?

Does anybody really care anymore if you're a good person.  From what I can see, all the assholes and shit people in the world are ones who are in love and starting families.  

Should I have tried to be good?  Does anybody appreciate being good anymore?  Does anything even matter anymore?  Should I just not give a shit and do whatever the fuck I want, walk all over the people in my life for my own personal advancement.  Maybe then I'll find love.  Maybe then I'll stop being lonely.  

Sorry for the rant.  I hope you can relate.  I'm just really fucking sad rn.  I will keep trying to be good, but god fucking damnit I am just so tired.  &lt;3",0.94,13,0,13,False
