,subreddit,id,title,selftext,upvote_ratio,ups,downs,score,Over 18?
0,loneliness,t5_2rlb9umjzi6,Tell us your story...,"Everyone is lonely, but not everyone is lonely in the same way.

Some people are lonely when they're physically isolated from others and some people are lonely even in a room full of people that love them.

Those are two common examples, but there are endless ways in which people can feel lonely, 8 billion ways in fact.

And there's not always a clear answer; some people are just lonely. It's a normal part of the human condition to feel lonely, and while you may want or even need to do everything in your power to rid yourself of it (depending on the severity of your situation), just know that being lonely in and of itself doesn't necessarily mean that there's anything wrong with you.

We don't measure or rate or judge each person's level of loneliness here and decide if they're ""lonely enough"" to be welcome here nor do we dictate any absolutes about the conditions for being lonely or how someone must behave if they're ""actually lonely.""

Every human-being in the world is welcome here, and their story for how they feel loneliness is valid; their pain is valid. As with most things in life, there's the book definition of a thing and then there's the complex emotional reality of a thing. Loneliness is a relative experience, and the way some people experience it won't always make sense to others, and it doesn't have to.

Just as there is no one-size-fits-all approach to feeling loneliness, there is no one-size-fits-all approach to healing either.

I don't presume to know your pain; we don't know your pain; tell us about it:

https://www.reddit.com/r/loneliness/submit

&amp;nbsp;
- - -
&amp;nbsp;

If you're feeling such extreme pain from loneliness to the point of contemplating suicide, please don't. **Just don't.**

Things to consider:

- **How old are you?** Did you know that the brain isn't fully developed until around the age of 25? That means that if you're a child, teenager, or even a young adult, by merely waiting out the storm, you might find sunshine on the other side, by simply maturing into the fully-formed you.

- **How bad is it?** As bad as it can get, it can almost always be worse. It's important to respect everyone's pain, because it's relative. As much empathy as one can have, you can never really feel another's pain, only your own. Still, it's important to keep perspective and think about the cruelty and lack of freedom experienced by those around the world.

- **Time is a master in its work.** We've all heard the saying that ""Time heals all wounds."" Well, it's pretty true for the most part. As long as you first get away from the toxic people, places, or circumstances that are hurting you and causing you trauma, the healing can begin. How long it will take, really depends on the person, and what they've experienced. It took me years to get over some of the trauma that I suffered. It's not that I don't still feel some level of pain from it, but my trauma no longer owns me; I own my trauma.

Suicide prevention starts and ends with you. Life is full of neverending beauty and darkness. I don't know about you, but I want to see it all. I want to stay on the path that is existence for as long as I can, even if at times, I have to walk through broken glass.

But, sometimes you need a little help. Share your thoughts here in this sub, reach out to a mental health expert, or maybe give a suicide hotline a try. As tacky and empty of a gesture as it might seem to put out the cliché boilerplate message: ""If you're having suicidal thoughts..."" I don't know, maybe these tools are actually pretty helpful for some people? It might be worth a try. The big one is:

suicidepreventionlifeline.org | 1-800-273-8255

***Full Disclosure:** I'm just a regular ol' dumb-dumb. I know just enough about psychology to get into trouble, but I'm certainly not an expert. All I can offer is that I care, and speak honestly from my heart. If you have ideas about ways we can improve r/loneliness and resources we should add, please share. Thank you.*",0.99,139,0,139,False
1,loneliness,t5_2rlb918frgpi,Tired of everything,"I've been having some feelings lately that there is no one who really cares about me 
i got lost in real life, i can't do homework, i got really low grades at tests, got away from my friends and took a step back, everything feels so wrong, like who am i?Trying to be better everyday its just too hard to get up and do what i have to do, there is no energy, and even if i start to do what i should along the day, at the end of it
THERE IS ONLY ME",1.0,3,0,3,False
2,loneliness,t5_2rlb918fopa4,How NOT to make friends in real life,"Loneliness sucks. What sucks even more is trying so hard to make friends in real life and failing. I shall try and turn my rampant bitterness due to my failures in making friends into a bad humour thing. So here we go, how NOT to make friends:

1. Put yourself out there and glimpse around different events and such. When noticing everyone at events are either with friends or in groups while you are sticking like a sour thumb or alien put your cool face on and tap yourself on the back for being brave

2. Chat with real life people about common stuff and smile when you (full of innocence and wonder)  ask to exchange social media contacts while they go into full avoidance mode and the music in the pub is too loud and they just can't be bothered 

3. Get really insecure about being lonely or an alien because it could only ever be your own personal fault (note the sarcasm?) for not having friends

4. Meet random people in real life, trying so hard to be friendly until they ghost you for no reason at all 

5. Do all the text book stuff: go to workshops, gatherings, cultural events, even book clubs. Pat on the back for getting outside of the house. Go back home with ""such empty"" feeling of people just not giving a damn

6. Be a complex person of 1000s of interests, hobbies and passions. Textbook stuff will tell you that's ideal for meeting new people. Real life will punch you in the face and usually you'll end up being too much or just crippling around with your lonliness luggage to ""admire""

7. Give up the whole idea and withdraw back into romanticized ""solitude"" of ""being your own best friend"" and totally disregard biological, mammal need for social interaction and community belonging

8. If bitterness arises (and it will and it will be time before Christmas and it will seem everyone has friends accept you) try to laugh it off or fully give in to people hating. You are entitled to your own inner Grumpy Archetype",1.0,5,0,5,False
3,loneliness,t5_2rlb918fcuxf,I don’t think friendship even exists anymore,"I honestly think the sad truth is people are too selfish to make true friends. It almost never happens in today’s society or economy. You just hang out with people who are fun to you, talk about meaningless boring shit to make time pass, and the friendship eventually fades away. It doesn’t last a lifetime, nor is it meaningful. I’m sure there are exceptions but it’s like the lottery or soul mates, it probably happened to someone but it will never happen to you.",0.95,14,0,14,False
4,loneliness,t5_2rlb918fdz7t,how does being single make you feel?,Feel free to use this post to get your feelings out :),1.0,10,0,10,False
5,loneliness,t5_2rlb918fgkgf,Social isolation,"Social isolation is the worst thing. I hate it. Im currently at that state right now as a 23 year old guy. It’s because of abroad studies. 

I thought it would become a new chapter of my life. But little did i know that it would be the darkest. I literally failed to make a single friend here, this means that i have nobody to interact with. It gets much harder on the weekends. It was my fault for hanging out with the wrong people that i would eventually never see again. Now im left with absolutely nobody. 

What concerns me the most is the fact that i have lost connection with my other friends from the country that i grew up in. This leads me with absolutely no friends left. I feel like everyone has forgotten about me. I miss my family, my previous friends, my old job and everything. And i usually see on social media that they are having fun and living life. While i am at my lowest point, in my apartment, in a country that I don’t know anybody. It’s a shame because i always thought i had social skills. Im not an introvert either. 

I hate social isolation. It’s the worst feeling. It feels like it’s draining my brain overtime. I am left exhausted everyday and i have no motivation to study or to do anything. Days can go by without me speaking to someone. I have no energy at all. Before all of this i used to be so productive, studied hard, worked out a lot. I even would cook for myself. But now It’s gotten to the point where I don’t even get out of bed anymore. I have spent so much money on food deliveries because i feel like I’m paralyzed. It’s been months like this..

I don’t know what to do. I thought about joining clubs but the people hardly understand english. Classmates want nothing to do with me. Any suggestions? Im sorry if this was too long, i just needed to dump my thoughts somewhere.",0.8,3,0,3,False
6,loneliness,t5_2rlb918f859x,Is loneliness directly related to how we look?,"I used to be very charming and joyful, it lasted for a while. But then I'm ngl. I feel my height (5'4) and my overall looks has something to do with the alienation I receive. I dont know. I've dated few women they all left me for someone taller and handsome. I just feel like I can't help it with my height and it's the main reason I experice I'm inferior to others. I don't know. I sometimes feel pointless with the weight of existence. They say looks don't matter but experiencing it first hand it matters a lot. Wad bullied for being tiny, was rejected by women for being short. Sometimes even by certain events back in college. Always the side character. I love prince. His disadvantage of height always made me work onymyself more. But it feels like a struggle. Do you think how we look is the reason we experience such alienation. I don't know  I hope not. Or am I just a shitty person with a shitty personality. It sucks.",1.0,3,0,3,False
7,loneliness,t5_2rlb918ffhlt,Is an app capable of curing loneliness ?,"In your opinion, why do the current apps on the market still greatly fail in this objective ?",1.0,1,0,1,False
8,loneliness,t5_2rlb918f3tfg,The worst feeling...,"I think one of the worst feelings of loneliness is going out and looking at couples holding their hands, kissing each other in love, being so happy, while you are in a miserable state of anhedonia and loneliness. Life is cruel to some! 
Don't get me wrong, I'm happy for these couples. I'm glad some people are having fun. But it makes me really sad I cannot have someone to fall in love and share my experiences with. Social anxiety, depression, PTSD... these things took a huge toll on me.",1.0,5,0,5,False
9,loneliness,t5_2rlb918f1tdx,"If were lonely, why not meet?",I am lonely also... and I thought why not meet someone? ,1.0,4,0,4,False
10,loneliness,t5_2rlb918f5w65,In search for u/Destroyedmywholelife,,1.0,1,0,1,False
11,loneliness,t5_2rlb918er1n5,Haven't got much to say just want some company.,"
I'm feeling very low and I want a friend who will stick with me and I can talk about my things without a second thought. And I want to be that friend to someone too.

If you want to know about me you can read my posts. 

I'm 17 so if you're near my age just text me already.",0.78,5,0,5,False
12,loneliness,t5_2rlb918enrha,Hello!,How do you deal with internal aggression towards society?,1.0,3,0,3,False
13,loneliness,t5_2rlb918emh7p,i just need some company:(,would anyone wants to talk,0.67,2,0,2,False
14,loneliness,t5_2rlb918ek0s6,No one to share things with,"Whenever I open up to others, I'm either met with disinterest or criticism. This happens regardless of the topic—whether it's discussing hobbies, sharing opinions, or simply joining in on discussions. 

It leaved me questioning if something's wrong with me or if I'm being too sensitive. I truly wish for someone who would listen without judging or dismissing what I have to say.

Does anyone else experience this? How do you cope when feeling like there's no one to open up to without facing disinterest or criticism?",0.83,4,0,4,False
15,loneliness,t5_2rlb918ekn16,M26 looking for a long-term friend.,,1.0,3,0,3,False
16,loneliness,t5_2rlb918eoq44,I just wanted someone to hug and hold.,"I get less than 10 nights a year that I share my bed with this person I enjoy the company of. I love sleeping with this person, specially on Friday night cause we can wake up ever so slowly and have a nice long breakfast the next morning. People that get that everyday just take it for granted most of the times. My heart is kinda squished and stressed up all the time from this loneliness. If I close my eyes and imagine there is someone here with me now, for a brief moment my body relaxes , the weekend seems like a long summer vacation, and the world more welcoming. Loneliness is kinda killing me . My heart is shrinking…",1.0,1,0,1,False
17,loneliness,t5_2rlb918dyohu,My Life's Purpose,"I don't know what I'm doing with my life. I'm a high school student, and I, despite practically having major opportunities after graduation, am incapable of living. I have no real friends, no real goals in my life, no feelings of empathy towards others, and few expectations for my own future; My own dissapointment for myself has always been like this, and at this point, I highly doubt things could even change for the better. I'm currently taking AP and honor classes, I have good grades, and have high expectatives from relatives, but I feel that all of this is completely worthless: A couple of years ago I was excited about high school and having a promising future by admitting higher education, but, today, I find myself helplessly lonely, distressed, weak, impotent, and lethargic, while I continue to deceive myself from escaping this torment.

I don't have any real friends or relatives: The few friends I have, barely talk to me now and/or rather choose to ignore me alltogether. It has always been like this, but I emphasized that, by having friends again, things could maybe change for the better. Now, however, I have come to the conclusion that there is no real escape from this delirium: I will always feel this way, no matter the amities, grades, professional help, dedication, or motivation I have.

I don't even know what I really have left. The only reason my life still has a purpose to serve, is to discern if, perhaps, this will be the last day of my ruthless ordeal. And despite my good academic performance, the truth is that I am mentally destroyed. As such, the purpose of my life is jumbled in an endless cycle of deranged monotony. Every single day is the same as the last one, and I can't take it anymore; Every week is repeated again and again, and I don't even know what to do anymore. My sense of humanity and empathy has been striped away by my own derangement, and I no longer feel any emotion or importance at all; I only feel that I exist under the same principle of escaping this endless torment, so much so, that I have lost myself.",0.88,6,0,6,False
18,loneliness,t5_2rlb918dw7p6,Fuck why,"14 years old. Know 8 languages, IQ 140. Still, no girls, no friends, no nothing. Advice?",1.0,3,0,3,False
19,loneliness,t5_2rlb918dmtwu,Sense of belonging," just realized that I never had a true sense of belonging, starting in my family. 

To my mom, I felt like I was never enough. I never felt like I truly belonged in my family. When I grew up, I always felt like I was not enough, no matter in which group/project I was. I'm almost 30, and I still feel like that. I tend to fall in love with guys that validate me, that make me feel loved, but I'm always way more into them than they are into me. I end up with a heartbreak, realizing that I misinterpret friendship for love. 

I know ppl prioritize themselves and I get why. I hace a hard time doing so. I always traveled on my own, never able to find a friend who was willing to go with me. 

Have you been there? How do you work on that? I'm feeling so lonely. I've tried doing new activities and being in groups, but I still feel like that.",0.92,10,0,10,False
20,loneliness,t5_2rlb918drpkb,Virtual dinner date anybody..?,,0.86,5,0,5,False
21,loneliness,t5_2rlb918dqpkp,Help us with a Research Survey: Trying to find the best way to connect the least connected people to combat loneliness.,"Survey Link: [https://forms.office.com/Pages/ResponsePage.aspx?id=sA0np77paEabo0fDROUm\_66pMcfcjZ9Ll47iInj96ydUODFMMUlVV0wxTzc5M0xFUzdVT1pUTTNaRy4u](https://forms.office.com/Pages/ResponsePage.aspx?id=sA0np77paEabo0fDROUm_66pMcfcjZ9Ll47iInj96ydUODFMMUlVV0wxTzc5M0xFUzdVT1pUTTNaRy4u) 

Hi all.

I am posting this for my research team. We are a group of undergraduates from The London Interdisciplinary School working with a social movement called Camerados to help make their 'public living rooms' more engaging and relevant to a broader range of cultural backgrounds. At the core of this is understanding why loneliness occurs, why people become disconnected and how we can attempt to reconnect people with movements like Camerados that can make you feel less alone.

Events at Camerados are without agenda. Camerados sees that the answer to our problems is each other. Whether that is talking about the larger problems we face in life or what biscuits we want with our tea today! Everyone has tough times and we think it'd be great if people looked out for one another more. Not fixing each other. Not trying to solve anyone's problems. Just being a bit more human. The events take place in temporary living rooms in the middle of the street, pop-ups or in permanent hubs in your community.

Thank you to anyone who fills this out - you are making a difference!

*All information given will be anonymous. All information given will only be used for this project. You can request your data at any point and remove it from our research.*

Find out more about us...

*Link for Camerados:* [*https://camerados.org/*](https://camerados.org/)

*Link for The London Interdisciplinary School:* [*https://www.lis.ac.uk/*](https://www.lis.ac.uk/)

&amp;#x200B;",1.0,3,0,3,False
22,loneliness,t5_2rlb918djpp2,I hate everyone and everything,"I was always laughed at growing up but never really took it to heart until my most recent situation. I had friends when I was 16-20 years old but I stopped being friends with them because they never wanted to work or do any outdoor activities besides smoke weed at a park or in my friends basement. I made a YouTube channel with one of them hoping to make money out of it as my parents were recently divorced and I moved in with my mom and my mom was single making about $18 an hour. I’ve seen horrible things that my mom did while she was going through her divorce, it was her first love for 20 years. But my friend wanted to make it public to the school and I didn’t want to but he already started telling people at school. I was embarrassed and humiliated but the school already knew so I did it anyways hoping to get more views and subscribers. I later somehow luckily found a girlfriend who was way out of my league and I found out why she stayed with me. Everything was good for the 3.5 years of being with her, we had ups and downs but our downs were really abusive and mentally frustrating and I later found out she cheated on me plenty of times. I’m glad it was over. I think the worst part was finding out she was only with me because a famous artist knew me and planned everything out and created a diss track towards me and I watched her easily leave me after all that and get paid millions. I was left to suffer and she even helped to publicly humiliate me everywhere I went to. My friends also used me for money. Now I’m alone and scared to make friends or girlfriends because it caused me to have insight of myself and realize I look like an autistic monkey, I’m Hispanic but look Asian and I’m 5’8 and really skinny and my head shape is really small and it feels like there’s a hole on the back left side of my head. I scared to make friends and be humiliated and used again. I’m scared to get girlfriends because I feel like it’ll all just happen again and they don’t actually like me. It’s like I helped everyone out but who’s going to help me?",0.91,8,0,8,False
23,loneliness,t5_2rlb918dhqnk,No confidence = Loneliness,Does anyone else feel that maybe the reason they are so lonely is because they don't have the confidence in themselves to survive in the world.,1.0,7,0,7,False
24,loneliness,t5_2rlb918dkf51,Looking for a long term friend and a study buddy?,"






If you are, then you have arrived at the right place!!

I too am looking for that, it gets lonely because all alone yk, so it's always good to have some company. I like writing long texts on absolutely random things I see or am thinking about and love it when I get long texts from others. 
I know some people struggle with being dry unintentionally so if you are that then tell me in the start. 

A bit about me: i read and like to collect stuff, i play a lot of Minecraft so expect me to send you random screenshots of my inventory or some stupid build I made, i like to walk and love walking on grass. I don't know what else I can say  but I'm open to questions. You can go through my depressing post history if you want to know more about me!

I want a long term platonic friendship with a strong bonding. We can bond over books movies our lives trauma or anything really. I just need some support and want to give some. 

If you decide to text me and don't know how to start, tell me what you ate today or did today, remember I like long texts so don't think that it will be weird. 

I'm 17 so be around that age. Thankk you ^⁠_⁠^",1.0,2,0,2,False
25,loneliness,t5_2rlb918dco7o,why is everyone finding love except me?,"even the ugliest, unsuccessful men are finding love from beautiful or hot women except me but god why??? :( it's humiliating, disappointing and making me lonely in this already sad and mean world",1.0,8,0,8,False
26,loneliness,t5_2rlb918dhycl,Loneliness makes me humiliate myself,I am so lonely. Like I have people that I call my friends but no one who really cares about me. My friend of 20 years told me that she doesn’t like to check in on me because she feels like I’m always sad and that I can’t get my shit together because I don’t have a six-figure salary like her. Anyone I talk to makes me feel bad about myself. We could be talking about things that we are passionate about and then when it’s my turn to speak I can’t get a word in or they tell me what I have to say doesn’t matter. I feel like I try so hard to keep people happy and not hate me that I’ve completely lost who I am. I do things that I do not value or would never do. I feel so much anger towards myself. I just wish someone cared about me. My parents don’t care too much for me. My therapist recently hinted that she’s tired of me. It’s really painful. I don’t know,0.8,3,0,3,False
27,loneliness,t5_2rlb918d64qj,Feeling sick from loneliness?,I feel like throwing up because I have no one. I have so much wrong with me and I have no one to support me. The physical effects of my social isolation are destroying me physically.,1.0,7,0,7,False
28,loneliness,t5_2rlb918dailh,How Wall Street's notoriously competitive culture is making its youngest recruits feel lonelier than ever,,0.57,1,0,1,False
29,loneliness,t5_2rlb918cgvj3,Endless Loneliness,"You can try to 'keep busy'/go to the gym/indulge in your favorite hobbies all you want but at the end of the day if you have no one to share your highs and lows/spend time with after a long day, life gets miserable, lonely and exhausting eventually. There's no substitute for a partner. And I'm not talking about a psych. You can even try to use as many of those therapy/venting apps as much as you want, none of them are substitutes for human company (crying might help you feel better tbh). 

Long story short, I'm lonely, mentally exhausted after more than a decade of 'staying strong' (tired of this fucking useless horseshit phrase), and have been having a lot of mood swings recently lol",1.0,13,0,13,False
30,loneliness,t5_2rlb918cknvp,Is it over?,"I’m 27 years old, live with my mom and work a low paying job. I’m ugly physically and I’m obese. I have autism and depression and find it very hard to make friends. In fact I have no friends at all. All I do on a daily basis is sleep, eat, work and sleep. I do not socialise at all. I feel worthless and know I am alone. I am starting to develop negative views of women. I know I’m unattractive to every woman in my current state and I want to get better but I feel it’s pointless and not going to improve anything.


But I have had sex off dating apps and several relationships albeit they barely last a few weeks. This is when I was slimmer and younger. The last time I had sex was off Tinder and that was over 2 years ago. But I’ve lost the will to do anything but sleep and eat. 

Am I an incel? Is there hope for me?",0.86,5,0,5,False
31,loneliness,t5_2rlb918cgct4,"Why people are so mean ,im talkative with ppl and people don't give the same energy and the care who i need",C,0.9,7,0,7,False
